{
  "ciclo": "2026Q4-S1",
  "data_riferimento": "2027-01-20",
  "analisi_evento": {
    "evento": "Il 12/01/2027 un cliente corporate della Banca ha disposto un bonifico istantaneo su richiesta telefonica della voce clonata del suo direttore finanziario; il beneficiario non era fra quelli abituali e il blocco non e' scattato (segnalazione interna del 12/01/2027). E' il primo caso documentato presso la Banca.",
    "catena_causale": "Causa: strumenti di clonazione vocale pronti all'uso (kit in vendita segnalati dal CERT finanziario) e bonifici istantanei irrevocabili. Evento: il cliente autorizza il pagamento credendo di parlare con un dirigente. Danno per la Banca: rimborso del cliente (obbligatorio per le frodi autorizzate dal 2027), reclami e attenzione dell'autorita'. Fatto: il caso del 12/01. Mia lettura: altri clienti corporate con pagamenti disposti per telefono sono esposti allo stesso schema.",
    "rischi_toccati": [
      {
        "id_rischio": "NFR-01",
        "effetto": "Probabilita da 4 a 5: il fenomeno e' ora osservato presso la Banca (descrittore 5)."
      },
      {
        "id_rischio": "NFR-07",
        "effetto": "Possibile effetto sui reclami e sulla condotta verso i clienti corporate se i rimborsi tardano: da verificare al trimestre, nessun dato oggi."
      }
    ],
    "rischi_non_toccati": "NFR-02 (fornitore cloud) e NFR-11 (sistemi di pagamento legacy): il caso non nasce da un guasto ne' da una vulnerabilita' dei sistemi, ma dall'inganno del cliente.",
    "documenti": [
      {
        "riferimento": "Segnalazione interna: bonifico istantaneo disposto con la voce clonata del direttore finanziario di un cliente corporate",
        "data": "2027-01-12",
        "uso": "il fatto e la sua data; base della Probabilita 5"
      },
      {
        "riferimento": "Incident report: frodi con voce sintetica su clienti corporate",
        "data": "2026-11-20",
        "uso": "tentativi precedenti non andati a buon fine: lo schema era gia' in corso"
      }
    ],
    "limiti": "Non si sa ancora se il cliente sara' rimborsato ne' l'importo recuperato; servono i dati dei bonifici corporate disposti per telefono nell'ultimo anno per misurare l'esposizione."
  },
  "rischi": [
    {
      "id_rischio": "NFR-01",
      "nome": "Frodi su pagamenti istantanei abilitate da AI generativa",
      "event_type": "9.7",
      "driver": [
        "DRV-AI",
        "DRV-CYB"
      ],
      "descrizione": "Frodi a danno dei clienti tramite voci o video sintetici che inducono bonifici istantanei irrevocabili verso conti di terzi.",
      "impatto": 4,
      "velocity": 5,
      "prossimita": 5,
      "probabilita": 5,
      "anni_adeguamento": null,
      "variazioni": [
        {
          "dimensione": "probabilita",
          "evidenza": "Primo caso documentato presso la Banca: il 12/01/2027 un cliente corporate ha disposto un bonifico istantaneo su richiesta della voce clonata del suo direttore finanziario (segnalazione interna).",
          "data_evidenza": "2027-01-12"
        }
      ],
      "fonti": [
        {
          "riferimento": "Analisi interna sulle frodi da ingegneria sociale",
          "data": "2025-10-20",
          "tipo": "Interna",
          "rilevanza": 3
        },
        {
          "riferimento": "Threat intelligence: campagne di frode con voce sintetica verso banche UE",
          "data": "2026-04-15",
          "tipo": "Esterna",
          "rilevanza": 2
        },
        {
          "riferimento": "Report trimestrale frodi — Funzione Antifrode",
          "data": "2026-06-10",
          "tipo": "Interna",
          "rilevanza": 3
        },
        {
          "riferimento": "Relazione annuale sui pagamenti al dettaglio dell'autorita' di vigilanza",
          "data": "2026-05-28",
          "tipo": "Esterna",
          "rilevanza": 3
        },
        {
          "riferimento": "Report trimestrale frodi Q3 — Funzione Antifrode",
          "data": "2026-09-12",
          "tipo": "Interna",
          "rilevanza": 3
        },
        {
          "riferimento": "Incident report: frodi con voce sintetica su clienti corporate",
          "data": "2026-11-20",
          "tipo": "Interna",
          "rilevanza": 3
        },
        {
          "riferimento": "Segnalazione interna: bonifico istantaneo disposto con la voce clonata del direttore finanziario di un cliente corporate",
          "data": "2027-01-12",
          "tipo": "Interna",
          "rilevanza": 3
        }
      ],
      "razionale": "RISCHIO: l'AI generativa rende facile imitare la voce o il volto di un dirigente o di un familiare (causa); il cliente, convinto, ordina un bonifico istantaneo verso un conto di terzi (evento); il pagamento e' irrevocabile in pochi secondi e, con l'obbligo di rimborso dal 2027, la perdita passa dal cliente alla Banca, insieme al danno reputazionale (danno). IMPATTO: grave. La Relazione annuale sui pagamenti al dettaglio dell'autorita' di vigilanza annuncia l'obbligo di rimborso delle frodi APP dal 2027: la perdita attesa cresce, con sanzioni probabili e danno reputazionale nazionale, ma la continuita' della Banca non e' toccata. PROBABILITA: 5, quasi certa: sale da 4 a 5 nel ciclo straordinario per il primo caso documentato presso la Banca (segnalazione interna del 2027-01-12: bonifico istantaneo disposto con la voce clonata del direttore finanziario di un cliente corporate). Non resta 4: il fenomeno non e' piu' solo presso altre banche. PROSSIMITA: in corso presso la Banca. L'Incident report del 20/11/2026 documenta due frodi con voce sintetica su clienti corporate, con bonifici gia' eseguiti. VELOCITY: entro un mese. Dal contatto fraudolento al bonifico passano minuti e il denaro esce subito (Report trimestrale frodi Q3).",
      "azioni_mitigazione": [
        {
          "descrizione": "Bloccare per 24 ore i bonifici istantanei corporate sopra 50.000 euro disposti dopo una richiesta telefonica, fino all'attivazione della verifica fuori banda",
          "owner": "Direzione Operations",
          "orizzonte": "3 mesi",
          "razionale": "Interrompe l'evento nel periodo in cui la verifica fuori banda non e' ancora attiva: il blocco lascia il tempo di richiamare il cliente su un numero registrato. Agisce sulla Probabilita. EFFETTO: nessun bonifico corporate disposto per telefono eseguito senza richiamata; il KRI di esposizione scende."
        }
      ],
      "kri_proposti": [
        {
          "kri_id": "NFR-01-K1",
          "tipo": "Evoluzione",
          "nome": "Tentativi di frode APP per 10.000 bonifici istantanei",
          "unita": "n/10k",
          "fonte_dati": "Sistema antifrode transazionale",
          "soglia_attenzione": 3,
          "soglia_allerta": 6,
          "razionale": "Misura quanto cresce il fenomeno sul canale piu' esposto: e' il primo segnale di nuove campagne contro i clienti della Banca. EFFETTO: con la verifica fuori banda i tentativi non calano subito, perche' dipendono dai truffatori, ma devono smettere di crescere; oltre la soglia di allerta il rischio e' in corso su larga scala."
        },
        {
          "kri_id": "NFR-01-K3",
          "tipo": "Esposizione",
          "nome": "Tempo medio di blocco di un beneficiario fraudolento",
          "unita": "ore",
          "fonte_dati": "Log del sistema di pagamento",
          "soglia_attenzione": 4,
          "soglia_allerta": 12,
          "razionale": "Misura quanto la Banca e' esposta: piu' a lungo resta attivo un beneficiario fraudolento, piu' bonifici possono raggiungerlo. EFFETTO: con la verifica fuori banda il tempo di blocco deve scendere sotto la soglia di attenzione; se sale, i controlli non tengono il passo delle frodi."
        }
      ]
    }
  ],
  "ricalcolo_kri_ciclo_precedente": [
    {
      "kri_id": "NFR-01-K1",
      "valore": 7.2,
      "fonte": "Report mensile antifrode di gennaio 2027 (dato al 15/01/2027)",
      "commento": "Riletto nello straordinario: i tentativi crescono dopo la diffusione dei kit di clonazione vocale."
    },
    {
      "kri_id": "NFR-01-K3",
      "valore": 5.0,
      "fonte": "Log del sistema di pagamento, estrazione del 18/01/2027",
      "commento": "Riletto nello straordinario: il caso del 12/01 ha richiesto piu' tempo per bloccare il beneficiario."
    }
  ],
  "sintesi": "MESSAGGIO: ciclo straordinario deciso dopo il primo caso di frode con voce clonata presso un cliente corporate della Banca (12/01/2027). Si rivaluta solo NFR-01: la Probabilita sale da 4 a 5 per il caso documentato; gli altri rischi restano quelli validati nel 2026Q4. DECISIONI: approvare il blocco temporaneo dei bonifici istantanei corporate disposti per telefono fino all'attivazione della verifica fuori banda."
}